"pname","slogan"
"จังหวัดตาก","“ธรรมชาติน่ายล ภูมิพลเขื่อนใหญ่ พระเจ้าตากเกรียงไกร เมืองไม้และป่างาม”"
"จังหวัดกาญจนบุรี","“แคว้นโบราณ ด่านเจดีย์ มณีเมืองกาญจน์ สะพานข้ามแม่น้ำแคว แหล่งแร่ น้ำตก”"
"จังหวัดราชบุรี","“คนสวยโพธาราม คนงามบ้านโป่ง เมืองโอ่งมังกร วัดขนอนหนังใหญ่ ตื่นใจถ้ำงาม ตลาดน้ำดำเนิน เพลินค้างคาวร้อยล้าน ย่านยี่สกปลาดี”"
"จังหวัดเพชรบุรี","“เขาวังคู่บ้าน ขนมหวาน เมืองพระ เลิศล้ำศิลปะ แดนธรรมะ ทะเลงาม”"
"จังหวัดประจวบคีรีขันธ์","“เมืองทองเนื้อเก้า มะพร้าวสับปะรด สวยสดหาดเขาถ้ำ งามล้ำน้ำใจ”"
